{
  "schema_version":"incidentseal-integrated-recovery-matrix/v1",
  "matrix_id":"IS4-U06-INTEGRATED-RECOVERY-001",
  "created_at_utc":"2026-08-10T04:25:00Z",
  "authority":{"mode":"platform-validation","approved_workflow_required":false,"workflow_executed":false,"host_cli_owns_docker":true},
  "composition":{
    "repetitions":2,
    "stage_order":["receipt-state-matrix","reliability-probe","journal-probe","recovery-probe","backup-restore-probe"],
    "commands":["receipt.materialize","receipt.verify","topology.reliability-probe","topology.journal-probe","topology.recovery-probe","topology.backup-restore-probe"],
    "arbitrary_arguments":false,
    "stage_isolation":true
  },
  "cases":[
    {"id":"receipt-exact-identity","surface":"receipt","expected_lifecycle":null,"expected_run_verdict":null,"expected_observation_verdict":"PASS","expected_exit_code":0,"repetitions":2},
    {"id":"receipt-unbound-identity","surface":"receipt","expected_lifecycle":null,"expected_run_verdict":null,"expected_observation_verdict":"INCONCLUSIVE","expected_exit_code":11,"repetitions":2},
    {"id":"receipt-missing-artifact","surface":"receipt","expected_lifecycle":null,"expected_run_verdict":null,"expected_observation_verdict":"INCONCLUSIVE","expected_exit_code":11,"repetitions":2},
    {"id":"receipt-corrupt-artifact","surface":"receipt","expected_lifecycle":null,"expected_run_verdict":null,"expected_observation_verdict":"FAIL","expected_exit_code":10,"repetitions":2},
    {"id":"receipt-invalid-identity","surface":"receipt","expected_lifecycle":null,"expected_run_verdict":null,"expected_observation_verdict":"INVALID","expected_exit_code":12,"repetitions":2},
    {"id":"reliability-completed-pass","surface":"reliability","expected_lifecycle":"completed","expected_run_verdict":"PASS","expected_observation_verdict":"PASS","expected_exit_code":0,"repetitions":2},
    {"id":"reliability-completed-fail","surface":"reliability","expected_lifecycle":"completed","expected_run_verdict":"FAIL","expected_observation_verdict":"FAIL","expected_exit_code":10,"repetitions":2},
    {"id":"reliability-malformed-input","surface":"reliability","expected_lifecycle":null,"expected_run_verdict":null,"expected_observation_verdict":"INVALID","expected_exit_code":12,"repetitions":2},
    {"id":"reliability-database-outage","surface":"reliability","expected_lifecycle":"failed","expected_run_verdict":null,"expected_observation_verdict":null,"expected_exit_code":21,"repetitions":2},
    {"id":"reliability-host-cancelled","surface":"reliability","expected_lifecycle":"cancelled","expected_run_verdict":null,"expected_observation_verdict":null,"expected_exit_code":20,"repetitions":2},
    {"id":"journal-stale","surface":"journal","expected_lifecycle":"stale","expected_run_verdict":null,"expected_observation_verdict":null,"expected_exit_code":22,"repetitions":2},
    {"id":"journal-superseded","surface":"journal","expected_lifecycle":"superseded","expected_run_verdict":null,"expected_observation_verdict":null,"expected_exit_code":23,"repetitions":2},
    {"id":"recovery-safe-replay","surface":"recovery","expected_lifecycle":"completed","expected_run_verdict":null,"expected_observation_verdict":"PASS","expected_exit_code":0,"repetitions":2},
    {"id":"recovery-ambiguous-effects","surface":"recovery","expected_lifecycle":"running","expected_run_verdict":null,"expected_observation_verdict":"INCONCLUSIVE","expected_exit_code":11,"repetitions":2},
    {"id":"recovery-conflicting-effects","surface":"recovery","expected_lifecycle":"running","expected_run_verdict":null,"expected_observation_verdict":"FAIL","expected_exit_code":21,"repetitions":2},
    {"id":"recovery-authority-stale","surface":"recovery","expected_lifecycle":"stale","expected_run_verdict":null,"expected_observation_verdict":"PASS","expected_exit_code":22,"repetitions":2},
    {"id":"recovery-concurrent-holder","surface":"recovery","expected_lifecycle":"running","expected_run_verdict":null,"expected_observation_verdict":"INCONCLUSIVE","expected_exit_code":11,"repetitions":2},
    {"id":"backup-restore-complete","surface":"backup_restore","expected_lifecycle":"completed","expected_run_verdict":null,"expected_observation_verdict":"PASS","expected_exit_code":0,"repetitions":2},
    {"id":"backup-restore-negative-privileges","surface":"backup_restore","expected_lifecycle":"completed","expected_run_verdict":null,"expected_observation_verdict":"PASS","expected_exit_code":0,"repetitions":2},
    {"id":"backup-restore-teardown","surface":"backup_restore","expected_lifecycle":"completed","expected_run_verdict":null,"expected_observation_verdict":"PASS","expected_exit_code":0,"repetitions":2}
  ],
  "cross_cycle":{"same_exact_images":true,"same_contract_digest":true,"same_semantic_receipts":true,"same_journal_streams":true,"same_recovery_decisions":true,"archive_identity_mode":"per-receipt-raw-plus-stable-normalized-toc","same_normalized_toc":true,"same_restored_state":true,"same_negative_privileges":true,"protected_volumes_unchanged":true,"teardown_between_stages":true,"teardown_after_cycle":true,"comparison_excludes":["archive_digest","backup_id","container_id","created_at_utc","invocation_id","receipt_digest"]},
  "custody":{"docker_socket_in_containers":false,"container_secrets":false,"broad_host_mounts":false,"external_runtime_network":false,"protected_volumes_mounted":false,"temporary_custody":"host-temp-outside-repository-and-onedrive","temporary_custody_removed":true,"disposable_only":true},
  "verification_verdict":"PASS",
  "matrix_digest":"sha256:31d04759cdeb4ec5030872087f549e4c31bb1c6d5235955622781bfa50f12b22"
}
